{
  "id": "0002-define-the-world-representation-and-renderer",
  "number": 2,
  "slug": "define-the-world-representation-and-renderer",
  "title": "Define the world representation and renderer",
  "status": "accepted",
  "template_variant": "data-model",
  "created_at": "2026-05-17T04:13:38.686Z",
  "updated_at": "2026-05-17T04:13:38.688Z",
  "summary": "How the room is stored in memory and rendered to the terminal each tick.",
  "issue": "The world is small (one 10×10 room) but the representation must support: easy frame rendering, fast collision/hazard checks, and a stable serialization that the agent can read on each tick. Pick a model now so the action handlers and renderer can converge.",
  "assumptions": [
    "10×10 fixed grid",
    "Single player entity",
    "Static tiles set at startup",
    "Frame fits in a single terminal redraw"
  ],
  "constraints": [
    "Frame must be readable both by humans and the LLM",
    "No external graphics libraries"
  ],
  "positions": [
    {
      "title": "Nested list of chars",
      "description": "world: list[list[str]] indexed by [y][x]. Player position stored separately.",
      "pros": [
        "Simplest possible",
        "Trivial to mutate",
        "Renders by row-join"
      ],
      "cons": [
        "No type safety on tile semantics",
        "Have to scan grid for entity positions"
      ],
      "links": []
    },
    {
      "title": "Tile-grid + entity dict",
      "description": "static_tiles: list[list[str]] for walls/floor/hazard/exit; entities: dict[id, {pos, hp, glyph}] overlaid at render time.",
      "pros": [
        "Separates static map from dynamic state",
        "Easy to add entities later if needed",
        "Clean serialization to JSON"
      ],
      "cons": [
        "Two structures to keep consistent",
        "Slightly more code"
      ],
      "links": []
    },
    {
      "title": "Single 2D numpy array + glyph table",
      "description": "Each cell is an int; render by mapping ints to glyphs.",
      "pros": [
        "Compact",
        "Fast",
        "Numpy is familiar"
      ],
      "cons": [
        "Numpy is overkill for 10×10",
        "Adds a dep we do not otherwise need",
        "Less Pythonic for tiny data"
      ],
      "links": []
    }
  ],
  "opinions": [],
  "argument": "Static map + entity overlay is the simplest model that survives the day-2 question can we add a second entity? without a rewrite. It serializes naturally to JSON for the LLM payload and keeps render code in one row-join.",
  "selected_position": "Tile-grid + entity dict",
  "implications": [
    "Tile glyphs: # wall, . floor, X hazard, > exit; entities overlay (@ for player).",
    "Each tick the renderer composes static_tiles + entity glyphs at their positions.",
    "JSON state sent to the agent: { frame: [<row strings>], hp, tick, exit_pos, player_pos }."
  ],
  "depends_on": [],
  "related_decisions": [],
  "related_artifacts": [],
  "review": [],
  "sign_off": {
    "by": "human",
    "actor": "kj",
    "at": "2026-05-17T04:13:38.688Z"
  },
  "tags": []
}
