{
  "id": "0003-define-the-agent-action-contract",
  "number": 3,
  "slug": "define-the-agent-action-contract",
  "title": "Define the agent action contract",
  "status": "accepted",
  "template_variant": "architecture",
  "created_at": "2026-05-17T04:13:38.689Z",
  "updated_at": "2026-05-17T04:13:38.690Z",
  "summary": "How the LLM receives the world state per tick and how it returns the chosen action.",
  "issue": "The agent must produce a structured, validated action every tick. We need the protocol pinned so the game loop never has to guess what the agent meant.",
  "assumptions": [
    "OpenAI-compatible API is the LLM transport",
    "Strategy prompt is supplied once at startup",
    "Per-tick latency budget ~2-5s is acceptable"
  ],
  "constraints": [
    "Action set is small (move N/S/E/W + noop)",
    "Agent must not stall the game with malformed output",
    "Must be debuggable from logs"
  ],
  "positions": [
    {
      "title": "Plain-text response parsing",
      "description": "Agent returns N/S/E/W/noop as plain text; we parse first token.",
      "pros": [
        "Lowest token cost",
        "Works with any model"
      ],
      "cons": [
        "Brittle to extra punctuation/prose",
        "No reasoning surface",
        "Hard to audit why"
      ],
      "links": []
    },
    {
      "title": "Tool-call (function calling) with one tool: do_action(direction)",
      "description": "Define a single OpenAI tool; agent invokes it once per tick with a strict enum direction.",
      "pros": [
        "Schema-validated",
        "Free reasoning text alongside the call",
        "Easy to extend with new actions later"
      ],
      "cons": [
        "Slightly more tokens per call",
        "Requires a model that supports function calling"
      ],
      "links": []
    },
    {
      "title": "JSON-only response with output_config",
      "description": "Force agent to emit {\"action\":\"N\",\"reason\":\"…\"} via structured outputs.",
      "pros": [
        "Schema-validated",
        "Reasoning captured in same payload"
      ],
      "cons": [
        "Some providers do not honor strict mode",
        "Slightly more setup than tool-call"
      ],
      "links": []
    }
  ],
  "opinions": [],
  "argument": "Tool-calling is the cleanest contract: the model gets free-form reasoning in `content` AND a strict-enum action in `tool_calls`. We can log both, and extending to new actions later is just adding enum values. Plain-text parsing trades 100 tokens of savings for a constant brittleness tax.",
  "selected_position": "Tool-call (function calling) with one tool: do_action(direction)",
  "implications": [
    "Define tool `do_action` with input_schema requiring `direction` in {N,S,E,W,noop}.",
    "Use tool_choice=\"required\" each tick to force a call.",
    "Log the assistant message text (the reasoning) alongside the chosen direction for replay/debug."
  ],
  "depends_on": [],
  "related_decisions": [],
  "related_artifacts": [],
  "review": [],
  "sign_off": {
    "by": "human",
    "actor": "kj",
    "at": "2026-05-17T04:13:38.690Z"
  },
  "tags": []
}
