{
  "id": "0001-choose-the-implementation-language",
  "number": 1,
  "slug": "choose-the-implementation-language",
  "title": "Choose the implementation language",
  "status": "accepted",
  "template_variant": "architecture",
  "created_at": "2026-05-17T04:13:38.681Z",
  "updated_at": "2026-05-17T04:13:38.685Z",
  "summary": "Decide the primary implementation language for the project.",
  "issue": "Every other foundational decision (runtime, package manager, framework choices, testing tools) flows from the language choice. Picking this early and explicitly avoids drift.",
  "assumptions": [
    "Team has existing language strengths to lean on.",
    "Project lifespan is long enough that hiring and onboarding matter.",
    "Ecosystem maturity matters for the project's domain."
  ],
  "constraints": [
    "Team's current expertise.",
    "Target runtime environments (browser, server, native, embedded).",
    "Performance and memory budgets.",
    "Licensing or compliance restrictions on language ecosystems."
  ],
  "positions": [
    {
      "title": "TypeScript",
      "description": "Strongly typed JavaScript. Best for full-stack web work, ubiquitous tooling.",
      "pros": [
        "Ubiquitous in web",
        "Strong types catch errors early",
        "Massive ecosystem",
        "Frontend/backend code sharing"
      ],
      "cons": [
        "Build step overhead",
        "Type system can be over-engineered",
        "Slower than native languages for hot paths"
      ],
      "links": []
    },
    {
      "title": "Python",
      "description": "Dynamic, batteries-included. Best for data work, scripting, ML, fast prototypes.",
      "pros": [
        "Excellent ML/data ecosystem",
        "Fast to write",
        "Readable",
        "Huge stdlib"
      ],
      "cons": [
        "Slow runtime without C extensions",
        "GIL limits concurrency",
        "Dynamic typing → runtime errors"
      ],
      "links": []
    },
    {
      "title": "Go",
      "description": "Statically typed, compiled, built for concurrent services.",
      "pros": [
        "Simple language",
        "Single binary deployment",
        "Strong concurrency primitives",
        "Fast compile times"
      ],
      "cons": [
        "Generics still maturing",
        "Verbose error handling",
        "Less rich third-party ecosystem than JS/Python"
      ],
      "links": []
    },
    {
      "title": "Rust",
      "description": "Memory-safe systems language. Best for performance-critical or systems work.",
      "pros": [
        "No GC, predictable performance",
        "Memory safety",
        "Excellent tooling (cargo)",
        "Strong types"
      ],
      "cons": [
        "Steep learning curve",
        "Slower to ship initial features",
        "Compile times can be long"
      ],
      "links": []
    }
  ],
  "opinions": [],
  "argument": "Python is fastest to write for a single-script game-loop POC. The OpenAI SDK + a tiny terminal renderer fit naturally; no build step or transpile loop slows iteration. Team is comfortable with Python and the project never needs to leave a single repo.",
  "selected_position": "Python",
  "implications": [
    "Use the official openai Python SDK for agent calls.",
    "Single-file or small-module layout; no package manager beyond pip/uv.",
    "Pin to Python 3.11+ for ergonomic match-statement parsing of agent actions."
  ],
  "depends_on": [],
  "related_decisions": [],
  "related_artifacts": [],
  "review": [],
  "sign_off": {
    "by": "human",
    "actor": "kj",
    "at": "2026-05-17T04:13:38.685Z",
    "notes": "poc preset, no review required"
  },
  "seed_origin": "language-choice",
  "tags": [
    "foundation",
    "poc",
    "foundation",
    "architecture",
    "stack"
  ]
}
